{
  "applicability": {
    "claimed_scope": "proven_context_only",
    "conditions": [
      "Applies to Node ESM entry points executed from a reconstructed partial toolchain"
    ],
    "expansion_requires_review": true,
    "proven_on": {
      "drupal_core_versions": [
        "11.4.5"
      ],
      "php_versions": [
        "8.3"
      ]
    }
  },
  "capture": {
    "captured_by": {
      "name": "drupal-knowledge-solved-case-capture",
      "version": "0.1"
    },
    "case_identity": "sha256:5bffad1b0b45288d90615443ebc72249a020aabc6689d7c4ff49c79506d50123",
    "contract_version": "0.1",
    "fix_category": "code_change",
    "origin_finding_id": null,
    "producer": {
      "name": "drupal-knowledge-fixture",
      "version": "0.1"
    },
    "promotion": {
      "automatic_promotion": false,
      "human_review_required": true,
      "trusted_knowledge_created": false
    },
    "root_cause_state": "confirmed",
    "verification": {
      "causality": {
        "state": "demonstrated",
        "statement": "The suite failed before the change and passed after it with no other tree change."
      },
      "performed": true,
      "results": [
        {
          "detail": "Previously failing rehydration test passes.",
          "evidence_ref": "release pipeline phase 3 suite",
          "method": "automated_test",
          "outcome": "passed"
        },
        {
          "evidence_ref": "validate-pack exit code transition 1 -> 0",
          "method": "reproduction_before_and_after",
          "outcome": "passed"
        }
      ]
    }
  },
  "drupal_versions": [
    "11.4.5"
  ],
  "environment": {
    "environment_class": "local-development",
    "project_fingerprint": "sha256:57b9d63ecba5731298f47b9583525209a6ab1ab1c5ef6b32acddd4dd12329dbc",
    "revision_fingerprint": "sha256:dfad83687a40979c97aafd3e674ebdafb4f99f6003740538ac7a4477b69e4d58"
  },
  "evidence": [],
  "first_seen": "sha256:57b9d63ecba5731298f47b9583525209a6ab1ab1c5ef6b32acddd4dd12329dbc",
  "id": "case.drupal.solved.code-change.5bffad1b0b45288d",
  "last_verified": "sha256:5bffad1b0b45288d90615443ebc72249a020aabc6689d7c4ff49c79506d50123",
  "limitations": [
    "Proven on a single project and a single Drupal core version",
    "Verified through the repository test suite only, not under production load",
    "Describes a tooling defect, not a Drupal core or contrib defect",
    "Carries no security severity evidence"
  ],
  "modules": [
    {
      "name": "drupal/core",
      "version": "11.4.5"
    }
  ],
  "occurrence_count": 1,
  "php_versions": [
    "8.3"
  ],
  "problem": "The managed-site update entry point aborted before performing any work when it was executed from a reconstructed toolchain that did not ship one of its imported modules.",
  "project_type": "drupal",
  "related_knowledge_ids": [],
  "root_cause": "A static top-level ESM import created a hard load-time dependency on a module that the reconstructed toolchain deliberately does not copy, so module resolution failed before the entry point executed.",
  "solution": [
    "Replace the static import with a call-time dynamic import so the entry point stays loadable.",
    "Declare the module directory as part of the toolchain the reconstruction copies."
  ],
  "status": "verified",
  "symptoms": [
    "Node exited with ERR_MODULE_NOT_FOUND before any update logic ran",
    "No machine-readable result document was produced",
    "The failure occurred identically on every invocation, including dry-run"
  ],
  "themes": [],
  "title": "Managed-site update script fails to load when an optional toolchain module is absent",
  "verification": [
    "automated_test: passed (release pipeline phase 3 suite)",
    "reproduction_before_and_after: passed (validate-pack exit code transition 1 -> 0)"
  ]
}
